{
  "$schema": "../schemas/run-request.schema.json",
  "request_id": "replace-generate-only",
  "stages": ["generate"],
  "stage_inputs": {
    "generate": [
      {
        "selector_id": "replace-plan-selector",
        "state": "request",
        "entity_type": "test_plan",
        "match": {"ids": ["replace-plan-id"]}
      }
    ]
  },
  "dependency_policy": "explicit_only",
  "missing_input_policy": "error",
  "sync_policy": "none",
  "existing_results_request_path": null,
  "benchmark_path": "BENCHMARK.md",
  "scenario_pack_path": "config/scenarios.json",
  "dry_run": true,
  "smoke_limit": 1,
  "manifest_directory": "var/manifests"
}
