{
  "$schema": "../schemas/run-request.schema.json",
  "request_id": "replace-import-evaluate-only",
  "stages": ["ingest", "preprocess", "evaluate"],
  "stage_inputs": {},
  "dependency_policy": "explicit_only",
  "missing_input_policy": "error",
  "sync_policy": "none",
  "existing_results_request_path": "config/existing-results.json",
  "benchmark_path": "BENCHMARK.md",
  "scenario_pack_path": "config/scenarios.json",
  "dry_run": true,
  "smoke_limit": null,
  "manifest_directory": "var/manifests"
}
