{
  "$schema": "../schemas/run-request.schema.json",
  "request_id": "replace-me",
  "stages": [
    "ingest",
    "plan",
    "generate",
    "preprocess",
    "evaluate",
    "report",
    "sync",
    "reconcile"
  ],
  "stage_inputs": {},
  "dependency_policy": "explicit_only",
  "missing_input_policy": "error",
  "sync_policy": "full",
  "existing_results_request_path": null,
  "benchmark_path": "BENCHMARK.md",
  "scenario_pack_path": "config/scenarios.json",
  "generation_modes": ["offline", "realtime"],
  "execution_mode": "streaming",
  "pipeline_queue_size": 4,
  "repeat_count": 5,
  "generation_mode_overrides": [],
  "dry_run": true,
  "smoke_limit": 1,
  "filters": {},
  "manifest_directory": "var/manifests",
  "comparison": {
    "comparison_id": "replace-me",
    "baseline_model_version": "replace-baseline-version",
    "candidate_model_version": "replace-candidate-version",
    "requested_scene_ids": ["replace-scene-id"],
    "report_template_path": "report-templates/model-version-update-report.md",
    "report_output_directory": "var/reports/model-version-updates"
  }
}
